{
  "trace_version": "mcf_gui_window_succession_trace/v1",
  "mission_id": "MCF-MESTRE-CROSS-CHAT-SUCCESSION-001",
  "classification": "MAINTAIN_WITH_GAP",
  "predecessor": {
    "session_id": "chat-predecessor-001",
    "window_surface_id": "brave-window-predecessor-001",
    "surface_preserved_through_equivalence_and_handoff": true
  },
  "successor": {
    "session_id": "chat-successor-001",
    "window_surface_id": "brave-window-successor-001"
  },
  "handoff": {
    "successor_equivalence": "PASS",
    "explicit_handoff": true,
    "predecessor_close_governed_separately": true
  },
  "window_control": {
    "open_new_window": true,
    "open_new_chat": true,
    "visual_assertion_two_windows": "PASS",
    "monitor_aware_placement": "PASS",
    "predecessor_monitor_id": "LVDS-1",
    "successor_monitor_id": "LVDS-1"
  },
  "input_evidence": {
    "mechanism": "DEVICE_LEVEL_INPUT_EVENT",
    "claimed_equivalent_to_physical_input": false,
    "shortcut": "Super+Left / Super+Right",
    "observed_effect": "window tiling action logged and geometry verified"
  },
  "observability": {
    "shortcut_execution_logged": true,
    "simultaneous_copresence_regression": "PASS",
    "evidence_refs": [
      "missions/MCF-MESTRE-CROSS-CHAT-SUCCESSION-001/GUI_WINDOW_CONTROL_FINDING_20260827.md",
      "missions/MCF-MESTRE-CROSS-CHAT-SUCCESSION-001/TEAM_CONSENSUS_GUI_WINDOW_20260827.md"
    ]
  }
}
